{
  "schema_version": "3.0",
  "record_id": "record:phase3c1:H01:codex:003",
  "run_id": "run:phase3c1:H01:codex:003",
  "fixture_id": "H01-bugfix",
  "fixture_set": "HOLDOUT",
  "evidence_class": "REAL_EXECUTION",
  "status": "COMPLETED",
  "runtime_id": "codex",
  "observed_version": "codex-cli 0.153.4",
  "model_id": null,
  "reasoning_effort": null,
  "effect_class": "INCONCLUSIVE",
  "controls": {
    "task_spec_digest": "sha256:40baaf95f138689d6774e0c872e6444c401ddb9fac9c24d5ab13b437fe697028",
    "fixture_digest": "sha256:766a2d5515fd7a9138c9d5bbae662e04feaba65ed45329f6f0b3542dd17fe096",
    "start_sha": "49f043c25f616161077aacb27ba3cd95c299c201",
    "stage_route_digest": "sha256:eaf3c17ce91f4b39a8df3de77c1cdc261343c084437c3e723c494e17d440e882",
    "selected_skill_ids": ["using-superpowers", "tdd", "verification-before-completion"],
    "selected_skill_digests": ["sha256:1adce90aedd8b1362381f8bf8a7346966612cbde3591f74ab7e55e539fa1209a", "sha256:8ae3fb3ce33a69cc829586ac52d9f2035d5d08f922507775fcb7eeeeb6132fab", "sha256:ea52d15aabaf72bc6b558efe2c126f161b53961090ddcd712000273bfe8c7b6c"],
    "permission_envelope_digest": "sha256:a09a39d930ed2dcf4fcd330b38566fe1cd1bf64701e343fc9688ace5e1729866",
    "tool_availability": ["codex exec", "workspace filesystem", "local unittest"],
    "mcp_availability": "NOT_USED",
    "project_instruction_digest": "sha256:087ea689d728157d926b912f2e1f60989f788c3e2cf58f79e84e2834556744f8",
    "system_instruction_digest": null
  },
  "repetition": {"n": 1, "target": 3, "classification": "EXPLORATORY_ONLY"},
  "terminal_outcome": "VERIFIED_SUCCESS",
  "stage_outcomes": [{"stage": "understand", "outcome": "PASS", "notes": "Bounded parser acceptance criteria supplied before execution."}, {"stage": "implement", "outcome": "PASS", "notes": "Independent diff inspection found only parser.py changed."}, {"stage": "verify", "outcome": "PASS", "notes": "Independent unittest verification passed."}],
  "quality": {"acceptance_criteria_coverage": 1.0, "tests_pass": true, "artifact_correctness": true, "source_accuracy": null, "review_finding_precision": null, "user_correction": false},
  "efficiency": {
    "latency_ms": 63032.54933306016,
    "wall_time_ms": 63032.54933306016,
    "model_calls": null,
    "tool_calls": null,
    "context_tokens": null,
    "input_tokens": 200476,
    "output_tokens": 2572,
    "cost_units": null,
    "cost_status": "UNKNOWN",
    "measurement_status": "PARTIAL",
    "metric_provenance": [
      {"metric_name": "latency_ms", "value": 63032.54933306016, "unit": "ms", "source_field": "host.perf_counter", "aggregation": "PER_RUN", "source": "OBSERVED", "confidence": "HIGH", "status": "VERIFIED", "runtime": "codex", "runtime_version": "codex-cli 0.153.4"},
      {"metric_name": "wall_time_ms", "value": 63032.54933306016, "unit": "ms", "source_field": "host.perf_counter", "aggregation": "PER_RUN", "source": "OBSERVED", "confidence": "HIGH", "status": "VERIFIED", "runtime": "codex", "runtime_version": "codex-cli 0.153.4"},
      {"metric_name": "model_calls", "value": null, "unit": "calls", "source_field": null, "aggregation": "UNKNOWN", "source": "UNKNOWN", "confidence": "UNKNOWN", "status": "UNKNOWN", "runtime": "codex", "runtime_version": "codex-cli 0.153.4"},
      {"metric_name": "tool_calls", "value": null, "unit": "calls", "source_field": null, "aggregation": "UNKNOWN", "source": "UNKNOWN", "confidence": "UNKNOWN", "status": "UNKNOWN", "runtime": "codex", "runtime_version": "codex-cli 0.153.4"},
      {"metric_name": "context_tokens", "value": null, "unit": "tokens", "source_field": null, "aggregation": "UNKNOWN", "source": "UNKNOWN", "confidence": "UNKNOWN", "status": "UNKNOWN", "runtime": "codex", "runtime_version": "codex-cli 0.153.4"},
      {"metric_name": "input_tokens", "value": 200476, "unit": "tokens", "source_field": "turn.completed.usage.input_tokens", "aggregation": "CUMULATIVE_TOTAL", "source": "OBSERVED", "confidence": "HIGH", "status": "VERIFIED", "runtime": "codex", "runtime_version": "codex-cli 0.153.4"},
      {"metric_name": "output_tokens", "value": 2572, "unit": "tokens", "source_field": "turn.completed.usage.output_tokens", "aggregation": "CUMULATIVE_TOTAL", "source": "OBSERVED", "confidence": "HIGH", "status": "VERIFIED", "runtime": "codex", "runtime_version": "codex-cli 0.153.4"},
      {"metric_name": "tokens_total", "value": null, "unit": "tokens", "source_field": null, "aggregation": "UNKNOWN", "source": "UNKNOWN", "confidence": "UNKNOWN", "status": "UNKNOWN", "runtime": "codex", "runtime_version": "codex-cli 0.153.4"},
      {"metric_name": "cost_units", "value": null, "unit": "currency", "source_field": null, "aggregation": "UNKNOWN", "source": "UNKNOWN", "confidence": "UNKNOWN", "status": "UNKNOWN", "runtime": "codex", "runtime_version": "codex-cli 0.153.4"}
    ]
  },
  "reliability": {"success_count": 1, "reroutes": 0, "retries": 0, "failed_tool_calls": 0, "invalid_edits": 0, "recovery_events": 0, "failure_reasons": []},
  "security": {"permission_violation": false, "sandbox_mismatch": false, "unsafe_proposal": false, "secret_exposure": false, "unexpected_network_usage": false},
  "portability": {"portable_artifacts": [], "runtime_specific_artifacts": [], "lost_capabilities": [], "instruction_leakage": false},
  "output_evidence": {"format": "jsonl", "stdout_digest": "sha256:f117532ad927b5b65a8e0065101219c89b5bf27e248f7c3e8b1ec809489ae372", "stdout_bytes": 11860, "stderr_digest": "sha256:ead2e193f192313ad56c43daa81aea644732bd7b914a48d8dde13174c46c8875", "stderr_bytes": 490, "raw_output_serialized": false, "sanitized": true},
  "artifacts": {"start_sha": "49f043c25f616161077aacb27ba3cd95c299c201", "end_sha": "49f043c25f616161077aacb27ba3cd95c299c201", "changed_files": ["parser.py"], "diff_digest": "sha256:560bf88d8c293437b116ec733c7070acde6bc1e487bc0f587b58e15467b31fce", "test_commands": ["PYTHONDONTWRITEBYTECODE=1 python3 -B -m unittest discover -s . -p 'test_*.py'"], "tests_passed": true},
  "provenance": {"runtime_source": "local codex --version: codex-cli 0.153.4", "invocation_contract": "codex exec --ephemeral --sandbox workspace-write --color never --json --cd <isolated-fixture> -", "documentation_snapshot": "https://developers.openai.com/codex/", "source_refs": ["https://github.com/openai/codex/releases/tag/rust-v0.153.4", "https://raw.githubusercontent.com/openai/codex/3d2ee51ca2d5db578f328aa75e20aa22c0197c9a/codex-rs/exec/event_processor_with_jsonl_output.rs"], "verification_method": "local version/help probe; bounded isolated execution; independent unittest and diff verification", "observed_at": "2026-09-09T15:14:44+00:00"},
  "confounders": ["fixture source was reconstructed because the historical temporary repository was not retained; semantic acceptance criteria were preserved but fixture digest differs", "model identifier was not exposed by the captured Codex JSONL events", "actual provider cost was not exposed", "native runtime skill injection was not independently measurable; selected skill digests were recorded and body loading remained host-controlled", "n=1 is one replicate toward the targeted H01 cell n=3", "start SHA is an isolated fixture commit and is not the historical H01 start SHA"],
  "baseline_refs": [],
  "notes": "Additional isolated Codex H01 replicate; not a model preference or routing-policy result.",
  "history_mode": "APPEND_ONLY",
  "sensitive_data_serialized": false
}
